{
  "id": "praesidium",
  "kind": "spell",
  "name": "Praesidium!",
  "summary": "The word that wakes the Praesidium Potion.",
  "trust": "tested",
  "sources": [
    "tay"
  ],
  "last_updated": "2026-10-27",
  "form": "spoken",
  "incantation": "Praesidium!",
  "activates": "praesidium-potion",
  "caster": {
    "race": "witch"
  },
  "effect": "Starts the protection of a [[praesidium-potion]].",
  "components": [
    {
      "item": "praesidium-potion",
      "qty": 1
    }
  ]
}
